{
    "checks": [
        {
            "id": "bleed",
            "status": "ok"
        },
        {
            "id": "content-bleed",
            "status": "warning"
        }
    ],
    "errors": [
    ],
    "fixups_available": [
        {
            "description": "Extend page boxes / artwork to provide bleed",
            "id": "add-bleed",
            "params": {
                "amount_pt": 9,
                "mode": "mirror"
            },
            "safe": false
        }
    ],
    "inspection_complete": true,
    "pass": true,
    "profile": "Sinalite Tiered Bleed",
    "schema_kind": "preflight-report",
    "schema_version": 3,
    "verdict": {
        "blocking_finding_ids": [
        ],
        "reason": "Inspection completed with no blocking findings.",
        "reason_code": "no-blocking-findings",
        "state": "pass",
        "waived_finding_ids": [
        ]
    },
    "warnings": [
        {
            "bbox": [
                1,
                1,
                219,
                219
            ],
            "check_id": "content-bleed",
            "message": "Artwork does not extend into bleed margin on left, right, top, bottom",
            "page": 1,
            "scope": "object",
            "severity": "warning",
            "type": "content-bleed"
        },
        {
            "bbox": [
                10,
                10,
                210,
                210
            ],
            "check_id": "content-bleed",
            "message": "Page is a candidate for the add-bleed fixup",
            "page": 1,
            "scope": "page",
            "severity": "info",
            "type": "needs-auto-bleed"
        }
    ]
}
