{
    "checks": [
        {
            "id": "embedded-fonts",
            "status": "ok"
        },
        {
            "id": "image-resolution",
            "status": "ok"
        },
        {
            "id": "bleed",
            "status": "ok"
        },
        {
            "id": "trim",
            "status": "ok"
        },
        {
            "id": "page-size",
            "status": "ok"
        },
        {
            "id": "color-mode",
            "status": "ok"
        },
        {
            "id": "transparency-risk",
            "status": "ok"
        },
        {
            "id": "color-inventory",
            "status": "ok"
        },
        {
            "id": "white-overprint",
            "status": "ok"
        }
    ],
    "errors": [
    ],
    "fixups_available": [
    ],
    "inspection_complete": true,
    "pass": true,
    "profile": "Loop Default",
    "schema_kind": "preflight-report",
    "schema_version": 4,
    "verdict": {
        "blocking_finding_ids": [
        ],
        "reason": "Inspection completed with no blocking findings.",
        "reason_code": "no-blocking-findings",
        "state": "pass",
        "waived_finding_ids": [
        ]
    },
    "warnings": [
        {
            "check_id": "color-inventory",
            "message": "Spot color detected: Spot",
            "object_id": "Spot",
            "scope": "document",
            "severity": "info",
            "type": "spot-color"
        },
        {
            "check_id": "color-inventory",
            "message": "Process output separation: Cyan",
            "object_id": "Cyan",
            "scope": "document",
            "severity": "info",
            "type": "separation"
        },
        {
            "check_id": "color-inventory",
            "message": "Process output separation: Magenta",
            "object_id": "Magenta",
            "scope": "document",
            "severity": "info",
            "type": "separation"
        },
        {
            "check_id": "color-inventory",
            "message": "Process output separation: Yellow",
            "object_id": "Yellow",
            "scope": "document",
            "severity": "info",
            "type": "separation"
        },
        {
            "check_id": "color-inventory",
            "message": "Process output separation: Black",
            "object_id": "Black",
            "scope": "document",
            "severity": "info",
            "type": "separation"
        },
        {
            "check_id": "color-inventory",
            "message": "Spot output separation: Spot",
            "object_id": "Spot",
            "scope": "document",
            "severity": "info",
            "type": "separation"
        },
        {
            "check_id": "color-inventory",
            "message": "Rich black detected on page 1 (approximately 2102.47 mm²; K > 10%).",
            "page": 1,
            "scope": "page",
            "severity": "info",
            "type": "rich-black"
        }
    ]
}
