{
    "checks": [
        {
            "id": "embedded-fonts",
            "status": "ok"
        },
        {
            "id": "image-resolution",
            "status": "ok"
        },
        {
            "id": "bleed",
            "status": "ok"
        },
        {
            "id": "trim",
            "status": "ok"
        },
        {
            "id": "page-size",
            "status": "ok"
        },
        {
            "id": "color-mode",
            "status": "failed"
        },
        {
            "id": "transparency-risk",
            "status": "ok"
        },
        {
            "id": "color-inventory",
            "status": "ok"
        },
        {
            "id": "white-overprint",
            "status": "ok"
        }
    ],
    "errors": [
        {
            "check_id": "color-mode",
            "message": "Disallowed color space(s) found on page 1: DeviceRGB (allowed: CMYK, Grayscale)",
            "page": 1,
            "scope": "page",
            "severity": "error",
            "type": "color-mode"
        }
    ],
    "fixups_available": [
        {
            "description": "Convert RGB content to an ICC-managed CMYK output condition",
            "id": "rgb-to-cmyk",
            "params": {
                "safe": true
            },
            "safe": false
        }
    ],
    "inspection_complete": true,
    "pass": false,
    "profile": "Loupe Default",
    "schema_kind": "preflight-report",
    "schema_version": 3,
    "verdict": {
        "blocking_finding_ids": [
            "528d93f17acabe3d"
        ],
        "reason": "One or more blocking findings require resolution or an active disposition.",
        "reason_code": "blocking-findings",
        "state": "fail",
        "waived_finding_ids": [
        ]
    },
    "warnings": [
        {
            "check_id": "color-inventory",
            "message": "Process output separation: Cyan",
            "object_id": "Cyan",
            "scope": "document",
            "severity": "info",
            "type": "separation"
        },
        {
            "check_id": "color-inventory",
            "message": "Process output separation: Magenta",
            "object_id": "Magenta",
            "scope": "document",
            "severity": "info",
            "type": "separation"
        },
        {
            "check_id": "color-inventory",
            "message": "Process output separation: Yellow",
            "object_id": "Yellow",
            "scope": "document",
            "severity": "info",
            "type": "separation"
        },
        {
            "check_id": "color-inventory",
            "message": "Process output separation: Black",
            "object_id": "Black",
            "scope": "document",
            "severity": "info",
            "type": "separation"
        }
    ]
}
