{
    "checks": [
        {
            "id": "bleed",
            "reason": "restriction_unsupported:page_box",
            "scope_restrictions": {
                "page_box": "trim"
            },
            "status": "not_inspected"
        }
    ],
    "error": {
        "code": "unsupported-scope",
        "message": "Check 'bleed' cannot honour the requested page_box restriction."
    },
    "errors": [
    ],
    "fixups_available": [
    ],
    "inspection_complete": false,
    "pass": false,
    "profile": "Loop Restriction - page-box",
    "schema_kind": "preflight-report",
    "schema_version": 4,
    "verdict": {
        "blocking_finding_ids": [
        ],
        "reason": "Check 'bleed' cannot honour the requested page_box restriction.",
        "reason_code": "unsupported-scope",
        "state": "incomplete",
        "waived_finding_ids": [
        ]
    },
    "warnings": [
    ]
}
