{
    "checks": [
        {
            "id": "bleed",
            "reason": "restriction_unsupported:regions",
            "scope_restrictions": {
                "regions": [
                    {
                        "anchor": "trim",
                        "mode": "include",
                        "name": "barcode",
                        "rect_pt": [
                            0,
                            0,
                            30,
                            20
                        ]
                    }
                ]
            },
            "status": "not_inspected"
        }
    ],
    "error": {
        "code": "unsupported-scope",
        "message": "Check 'bleed' cannot honour the requested regions restriction."
    },
    "errors": [
    ],
    "fixups_available": [
    ],
    "inspection_complete": false,
    "pass": false,
    "profile": "Loop Restriction - region",
    "schema_kind": "preflight-report",
    "schema_version": 4,
    "verdict": {
        "blocking_finding_ids": [
        ],
        "reason": "Check 'bleed' cannot honour the requested regions restriction.",
        "reason_code": "unsupported-scope",
        "state": "incomplete",
        "waived_finding_ids": [
        ]
    },
    "warnings": [
    ]
}
