{
    "checks": [
        {
            "id": "embedded-fonts",
            "status": "ok"
        },
        {
            "id": "image-resolution",
            "status": "ok"
        },
        {
            "id": "bleed",
            "status": "ok"
        },
        {
            "id": "trim",
            "status": "ok"
        },
        {
            "id": "page-size",
            "status": "ok"
        },
        {
            "id": "color-mode",
            "status": "ok"
        },
        {
            "id": "transparency-risk",
            "status": "ok"
        },
        {
            "id": "color-inventory",
            "status": "ok"
        },
        {
            "id": "white-overprint",
            "status": "ok"
        }
    ],
    "errors": [
    ],
    "fixups_available": [
        {
            "description": "Downsample 1 oversized image(s) toward 300 DPI",
            "id": "downsample-images",
            "params": {
                "candidate_count": 1,
                "preserve_color": true,
                "preserve_transparency": true,
                "quality": 90,
                "target_dpi": 300
            },
            "safe": false
        }
    ],
    "inspection_complete": true,
    "pass": true,
    "profile": "Loop Default",
    "schema_kind": "preflight-report",
    "schema_version": 4,
    "verdict": {
        "blocking_finding_ids": [
        ],
        "reason": "Inspection completed with no blocking findings.",
        "reason_code": "no-blocking-findings",
        "state": "pass",
        "waived_finding_ids": [
        ]
    },
    "warnings": [
        {
            "check_id": "color-inventory",
            "message": "Process output separation: Cyan",
            "object_id": "Cyan",
            "scope": "document",
            "severity": "info",
            "type": "separation"
        },
        {
            "check_id": "color-inventory",
            "message": "Process output separation: Magenta",
            "object_id": "Magenta",
            "scope": "document",
            "severity": "info",
            "type": "separation"
        },
        {
            "check_id": "color-inventory",
            "message": "Process output separation: Yellow",
            "object_id": "Yellow",
            "scope": "document",
            "severity": "info",
            "type": "separation"
        },
        {
            "check_id": "color-inventory",
            "message": "Process output separation: Black",
            "object_id": "Black",
            "scope": "document",
            "severity": "info",
            "type": "separation"
        }
    ]
}
