{
    "checks": [
        {
            "id": "page-size",
            "status": "failed"
        },
        {
            "id": "trim",
            "status": "failed"
        }
    ],
    "errors": [
        {
            "bbox": [
                0,
                0,
                540,
                720
            ],
            "check_id": "page-size",
            "message": "Page size 540 x 720 pt does not match expected 612 x 792 pt (tolerance 1 pt)",
            "page": 1,
            "scope": "page",
            "severity": "error",
            "type": "page-size"
        },
        {
            "bbox": [
                0,
                0,
                540,
                720
            ],
            "check_id": "trim",
            "message": "TrimBox 540 x 720 pt does not match expected 612 x 792 pt (tolerance 1 pt)",
            "page": 1,
            "scope": "page",
            "severity": "error",
            "type": "trim"
        }
    ],
    "fixups_available": [
    ],
    "inspection_complete": true,
    "pass": false,
    "profile": "Loop Test - Trim/Page Size",
    "schema_kind": "preflight-report",
    "schema_version": 4,
    "verdict": {
        "blocking_finding_ids": [
            "e706f630b3fcb901",
            "83dc5ea39c83eb9f"
        ],
        "reason": "One or more blocking findings require resolution or an active disposition.",
        "reason_code": "blocking-findings",
        "state": "fail",
        "waived_finding_ids": [
        ]
    },
    "warnings": [
    ]
}
