{
    "checks": [
        {
            "id": "transparency-risk",
            "status": "warning"
        }
    ],
    "errors": [
    ],
    "fixups_available": [
    ],
    "inspection_complete": true,
    "pass": true,
    "profile": "Loop Test - Transparency Risk",
    "schema_kind": "preflight-report",
    "schema_version": 3,
    "verdict": {
        "blocking_finding_ids": [
        ],
        "reason": "Inspection completed with no blocking findings.",
        "reason_code": "no-blocking-findings",
        "state": "pass",
        "waived_finding_ids": [
        ]
    },
    "warnings": [
        {
            "check_id": "transparency-risk",
            "message": "Potential transparency blend-space mismatch: CMYK group contains Spot content",
            "page": 1,
            "scope": "page",
            "severity": "warning",
            "type": "transparency-blend-space"
        }
    ]
}
